<?xml version="1.0"?>
<!--
/**
 * Magento
 *
 * NOTICE OF LICENSE
 *
 * This source file is subject to the Academic Free License (AFL 3.0)
 * that is bundled with this package in the file LICENSE_AFL.txt.
 * It is also available through the world-wide-web at this URL:
 * http://opensource.org/licenses/afl-3.0.php
 * If you did not receive a copy of the license and are unable to
 * obtain it through the world-wide-web, please send an email
 * to license@magentocommerce.com so we can send you a copy immediately.
 *
 * DISCLAIMER
 *
 * Do not edit or add to this file if you wish to upgrade Magento to newer
 * versions in the future. If you wish to customize Magento for your
 * needs please refer to http://www.magentocommerce.com for more information.
 *
 * @copyright   Copyright (c) 2014 X.commerce, Inc. (http://www.magentocommerce.com)
 * @license     http://opensource.org/licenses/afl-3.0.php  Academic Free License (AFL 3.0)
 */
-->
<routes xmlns:xsi="http://www.w3.org/2001/XMLSchema-instance"
        xsi:noNamespaceSchemaLocation="../../../../../app/code/Magento/Webapi/etc/webapi.xsd">
    <route url="/V1/bundle-products/:productSku/links/:optionId" method="POST">
        <service class="Magento\Bundle\Service\V1\Product\Link\WriteServiceInterface" method="addChild"/>
        <resources>
            <resource ref="Magento_Catalog::products"/>
        </resources>
    </route>
    <route url="/V1/bundle-products/:productId/children" method="GET">
        <service class="Magento\Bundle\Service\V1\Product\Link\ReadServiceInterface" method="getChildren"/>
        <resources>
            <resource ref="Magento_Catalog::products"/>
        </resources>
    </route>
    <route url="/V1/bundle-products/:productSku/option/:optionId/child/:childSku" method="DELETE">
        <service class="Magento\Bundle\Service\V1\Product\Link\WriteServiceInterface" method="removeChild"/>
        <resources>
            <resource ref="Magento_Catalog::products"/>
        </resources>
    </route>
    <route url="/V1/bundle-products/:productSku/option/all" method="GET">
        <service class="Magento\Bundle\Service\V1\Product\Option\ReadServiceInterface" method="getList" />
        <resources>
            <resource ref="Magento_Catalog::products" />
        </resources>
    </route>
    <route url="/V1/bundle-products/option/types" method="GET">
        <service class="Magento\Bundle\Service\V1\Product\Option\Type\ReadServiceInterface" method="getTypes" />
        <resources>
            <resource ref="Magento_Catalog::products" />
        </resources>
    </route>
    <route url="/V1/bundle-products/:productSku/option/:optionId" method="GET">
        <service class="Magento\Bundle\Service\V1\Product\Option\ReadServiceInterface" method="get" />
        <resources>
            <resource ref="Magento_Catalog::products" />
        </resources>
    </route>
    <route url="/V1/bundle-products/:productSku/option/add" method="POST">
        <service class="Magento\Bundle\Service\V1\Product\Option\WriteServiceInterface" method="add" />
        <resources>
            <resource ref="Magento_Catalog::products" />
        </resources>
    </route>
    <route url="/V1/bundle-products/:productSku/option/:optionId" method="PUT">
        <service class="Magento\Bundle\Service\V1\Product\Option\WriteServiceInterface" method="update" />
        <resources>
            <resource ref="Magento_Catalog::products" />
        </resources>
    </route>
    <route url="/V1/bundle-products/:productSku/option/:optionId" method="DELETE">
        <service class="Magento\Bundle\Service\V1\Product\Option\WriteServiceInterface" method="remove" />
        <resources>
            <resource ref="Magento_Catalog::products" />
        </resources>
    </route>
</routes>
