<?xml version="1.0"?>
<!--
/**
 * Magento
 *
 * NOTICE OF LICENSE
 *
 * This source file is subject to the Academic Free License (AFL 3.0)
 * that is bundled with this package in the file LICENSE_AFL.txt.
 * It is also available through the world-wide-web at this URL:
 * http://opensource.org/licenses/afl-3.0.php
 * If you did not receive a copy of the license and are unable to
 * obtain it through the world-wide-web, please send an email
 * to license@magentocommerce.com so we can send you a copy immediately.
 *
 * DISCLAIMER
 *
 * Do not edit or add to this file if you wish to upgrade Magento to newer
 * versions in the future. If you wish to customize Magento for your
 * needs please refer to http://www.magentocommerce.com for more information.
 *
 * @copyright   Copyright (c) 2014 X.commerce, Inc. (http://www.magentocommerce.com)
 * @license     http://opensource.org/licenses/afl-3.0.php  Academic Free License (AFL 3.0)
 */
-->
<routes xmlns:xsi="http://www.w3.org/2001/XMLSchema-instance"
        xsi:noNamespaceSchemaLocation="../../../../../../../../../app/code/Magento/Webapi/etc/webapi.xsd">
    <route url="/V1/testmodule1/:id" method="GET">
        <service class="Magento\TestModule1\Service\V1\AllSoapAndRestInterface" method="item"/>
        <resources>
            <resource ref="Magento_Test1::resource1"/>
        </resources>
    </route>
    <route url="/V2/testmodule1/:id" method="GET">
        <service class="Magento\TestModule1\Service\V2\AllSoapAndRestInterface" method="item"/>
        <resources>
            <resource ref="Magento_Test1::resource1"/>
            <resource ref="Magento_Test1::resource2"/>
        </resources>
    </route>
    <route url="/V2/testmodule1" method="POST">
        <service class="Magento\TestModule1\Service\V2\AllSoapAndRestInterface" method="create"/>
        <resources>
            <resource ref="Magento_Test1::resource1"/>
            <resource ref="Magento_Test1::resource2"/>
        </resources>
        <data>
            <parameter name="id" force="true">null</parameter>
        </data>
    </route>
    <route url="/V2/testmodule1/:id" method="DELETE">
        <service class="Magento\TestModule1\Service\V2\AllSoapAndRestInterface" method="delete"/>
        <resources>
            <resource ref="Magento_Test1::resource1"/>
            <resource ref="Magento_Test1::resource2"/>
        </resources>
    </route>
</routes>
